{
  "manifestVersion": "ores.otel.sdk-manifest/v1",
  "language": "ruby",
  "ecosystem": "RubyGems",
  "runtime": "Ruby",
  "sourceRoot": "sdk/ruby",
  "package": {
    "legacyName": "oresoftware-next-loggers",
    "canonicalName": "ores-otel-log",
    "nativeModule": "OresOtelLog"
  },
  "repositories": {
    "canonical": "ores-otel/ores.otel.log",
    "legacy": "ORESoftware/next-loggers.ts"
  },
  "wire": {
    "recordVersion": "next-loggers/v1",
    "recordSchema": "contracts/log-record.schema.json",
    "contextSchema": "contracts/schemas/log-context.schema.json",
    "otelLogSchema": "contracts/schemas/otel-log-record.schema.json",
    "batchSchema": "contracts/schemas/transport-batch.schema.json"
  },
  "api": {
    "logger": {
      "trace": ["trace"],
      "debug": ["debug"],
      "info": ["info", "log"],
      "warn": ["warn"],
      "error": ["error"],
      "fatal": ["fatal"],
      "flush": ["flush"],
      "flushOnExit": ["flush_on_exit"],
      "close": ["close"]
    },
    "event": {
      "addFields": ["add_fields"],
      "addTrace": ["add_trace", "add_trace_id"],
      "addRoutineId": ["add_routine_id"],
      "addTags": ["add_tags"],
      "addContext": ["add_context"],
      "addMeta": ["add_meta"],
      "addUser": ["add_user_info", "add_logged_in_user_info"],
      "send": ["send"]
    },
    "transport": {
      "write": ["write"],
      "flush": ["flush"],
      "flushOnExit": ["flush_on_exit"],
      "close": ["close"]
    }
  },
  "context": {
    "status": "partial",
    "strategy": "fiber-local-and-thread-local",
    "propagation": "fiber",
    "isolation": "concurrent-safe",
    "symbols": {
      "run": ["with_log_context"],
      "current": ["current_log_context"],
      "update": ["update_log_context"],
      "apply": ["Event#apply_context"],
      "withSpan": ["with_span"]
    },
    "mergesLoggedInUser": true,
    "mergesFields": true,
    "deduplicatesTraceIds": true,
    "restoresAfterFailure": true
  },
  "telemetry": {
    "opentelemetry": {
      "adapterSymbols": ["OtelTransport"],
      "explicit": true,
      "automaticInstrumentation": false,
      "monkeyPatching": false,
      "ownsProvider": false,
      "wrapsLoggerCalls": true,
      "sampledOutCorrelation": false,
      "recordingSpanEventsOnly": false
    },
    "supabase": {
      "adapterSymbols": ["SupabaseTransport"],
      "authenticatedSender": true,
      "durableBatchSchema": "next-loggers/batch/v1",
      "allowsDistributedSecrets": false,
      "realtimeIsDurable": false
    }
  },
  "conformance": {
    "command": "ruby sdk/ruby/test/next_loggers_test.rb",
    "recordFixture": "contracts/fixtures/conformance-record.json",
    "sourceFiles": [
      "sdk/ruby/lib/oresoftware/next_loggers.rb",
      "sdk/ruby/test/next_loggers_test.rb"
    ],
    "validatesJsonSchema": false,
    "testsContextIsolation": false,
    "testsNoMonkeyPatching": false
  },
  "promotion": {
    "ready": false,
    "blockers": [
      "Add Fiber-local context with thread fallback and ensure/unwind restoration tests."
    ]
  }
}
