{
  "manifestVersion": "ores.otel.sdk-manifest/v1",
  "language": "rust",
  "ecosystem": "crates.io",
  "runtime": "Rust native",
  "sourceRoot": "sdk/rust",
  "package": {
    "legacyName": "oresoftware-next-loggers",
    "canonicalName": "ores-otel-log",
    "nativeModule": "ores_otel_log"
  },
  "repositories": {
    "canonical": "ores-otel/ores.otel.log",
    "legacy": "ORESoftware/next-loggers.ts"
  },
  "wire": {
    "recordVersion": "next-loggers/v1",
    "recordSchema": "contracts/log-record.schema.json",
    "contextSchema": "contracts/schemas/log-context.schema.json",
    "otelLogSchema": "contracts/schemas/otel-log-record.schema.json",
    "batchSchema": "contracts/schemas/transport-batch.schema.json"
  },
  "api": {
    "logger": {
      "trace": ["trace"],
      "debug": ["debug"],
      "info": ["info", "log"],
      "warn": ["warn"],
      "error": ["error"],
      "fatal": ["fatal"],
      "flush": ["flush"],
      "flushOnExit": ["flush_on_exit"],
      "close": ["close"]
    },
    "event": {
      "addFields": ["add_fields"],
      "addTrace": ["add_trace", "add_trace_id"],
      "addRoutineId": ["add_routine_id"],
      "addTags": ["add_tags"],
      "addContext": ["add_context"],
      "addMeta": ["add_meta"],
      "addUser": ["add_user_info", "add_logged_in_user_info"],
      "send": ["send"]
    },
    "transport": {
      "write": ["write"],
      "flush": ["flush"],
      "flushOnExit": ["flush_on_exit"],
      "close": ["close"]
    }
  },
  "context": {
    "status": "implemented",
    "strategy": "thread-local-and-task-scope",
    "propagation": "thread",
    "isolation": "concurrent-safe",
    "symbols": {
      "run": ["with_log_context", "with_log_context_async", "enter_log_context"],
      "current": ["current_log_context", "capture_log_context"],
      "update": ["update_log_context", "merge_log_context"],
      "apply": ["apply_log_context", "apply_current_log_context"],
      "withSpan": ["with_span", "with_span_async"]
    },
    "mergesLoggedInUser": true,
    "mergesFields": true,
    "deduplicatesTraceIds": true,
    "restoresAfterFailure": true
  },
  "telemetry": {
    "opentelemetry": {
      "adapterSymbols": ["OpenTelemetryTransport", "with_span", "with_span_async"],
      "explicit": true,
      "automaticInstrumentation": false,
      "monkeyPatching": false,
      "ownsProvider": false,
      "wrapsLoggerCalls": true,
      "sampledOutCorrelation": true,
      "recordingSpanEventsOnly": true
    },
    "supabase": {
      "adapterSymbols": ["SupabaseTransport"],
      "authenticatedSender": true,
      "durableBatchSchema": "next-loggers/batch/v1",
      "allowsDistributedSecrets": false,
      "realtimeIsDurable": false
    }
  },
  "conformance": {
    "command": "cargo test --manifest-path sdk/rust/Cargo.toml",
    "recordFixture": "contracts/fixtures/conformance-record.json",
    "sourceFiles": [
      "sdk/rust/src/lib.rs",
      "sdk/rust/src/core.rs",
      "sdk/rust/src/context.rs",
      "sdk/rust/src/span.rs",
      "sdk/rust/tests/conformance.rs",
      "sdk/rust/tests/context.rs",
      "sdk/rust/tests/span.rs"
    ],
    "validatesJsonSchema": false,
    "testsContextIsolation": true,
    "testsNoMonkeyPatching": true
  },
  "promotion": {
    "ready": false,
    "blockers": [
      "Validate Rust-emitted records directly against the canonical JSON Schema before package promotion."
    ]
  }
}
